{
  "$schema": "http://json-schema.org/draft-07/schema#",
  "title": "PiWebUiPluginMetadata",
  "description": "Metadata definition for a pi-web-ui plugin registry entry",
  "type": "object",
  "required": ["id", "name", "source", "description", "author"],
  "additionalProperties": false,
  "properties": {
    "id": {
      "type": "string",
      "pattern": "^[A-Za-z0-9_-]+$",
      "minLength": 2,
      "maxLength": 50,
      "description": "Unique plugin identifier, matches folder name and install dir"
    },
    "name": {
      "type": "string",
      "minLength": 1,
      "maxLength": 50,
      "description": "Display name of the plugin"
    },
    "source": {
      "type": "string",
      "maxLength": 300,
      "pattern": "^([A-Za-z0-9_.-]+/[A-Za-z0-9_.-]+(/[A-Za-z0-9_.-]+)*(#[A-Za-z0-9_.-]+)?|https://github\\.com/[A-Za-z0-9_.-]+/[A-Za-z0-9_.-]+.*)$",
      "description": "GitHub repository specifier (owner/repo, owner/repo/subdir[#ref], or full GitHub URL)"
    },
    "author": {
      "type": "string",
      "pattern": "^[A-Za-z0-9_.-]+$",
      "minLength": 1,
      "maxLength": 50,
      "description": "GitHub username or organization of the author"
    },
    "description": {
      "type": "string",
      "minLength": 5,
      "maxLength": 300,
      "description": "Chinese description of the plugin"
    },
    "descriptionEn": {
      "type": "string",
      "maxLength": 300,
      "description": "Optional English description of the plugin"
    },
    "homepage": {
      "type": "string",
      "format": "uri",
      "maxLength": 300,
      "description": "Optional project homepage or GitHub tree URL"
    },
    "icon": {
      "type": "string",
      "maxLength": 10,
      "description": "Optional emoji icon for the plugin"
    },
    "iconSvg": {
      "type": "string",
      "maxLength": 4096,
      "description": "Optional inline SVG icon (must begin with <svg and end with </svg>, no script/event handlers)"
    },
    "tags": {
      "type": "array",
      "items": {
        "type": "string",
        "maxLength": 30
      },
      "maxItems": 10,
      "description": "Keywords or category tags"
    }
  }
}
