{
  "id": "legado-web",
  "name": "legado-web",
  "source": "xing-shuyin/pi-web-ui/plugins/legado-web",
  "author": "xing-shuyin",
  "description": "Legado 阅读（文本源）：搜索 / 发现 / 详情 / 目录 / 正文，书源 JSON 与安卓版兼容，可导入、检测、删废源；内置跨域+GBK 代理与本地存储，并给 AI 配了修源接口（读规则、读书源文件、逐步诊断链路、试规则验证）。",
  "descriptionEn": "Legado reader (text book sources): search / explore / info / TOC / content with Android-compatible book source JSON, plus source import and health checking. Ships its own CORS+GBK proxy, local store, and AI tools to diagnose and repair book sources.",
  "icon": "📖",
  "iconSvg": "<svg xmlns=\"http://www.w3.org/2000/svg\" viewBox=\"0 0 24 24\" fill=\"none\" stroke=\"currentColor\" stroke-width=\"2\" stroke-linecap=\"round\" stroke-linejoin=\"round\"><path d=\"M2 3h6a4 4 0 0 1 4 4v14a3 3 0 0 0-3-3H2z\"/><path d=\"M22 3h-6a4 4 0 0 0-4 4v14a3 3 0 0 1 3-3h7z\"/></svg>",
  "homepage": "https://github.com/xing-shuyin/pi-web-ui/tree/main/plugins/legado-web",
  "tags": [
    "plugin"
  ]
}
