{
  "id": "db-client",
  "name": "db-client",
  "source": "xing-shuyin/pi-web-ui/plugins/db-client",
  "author": "xing-shuyin",
  "description": "数据库连接管理：MySQL / PostgreSQL / SQLite / SQL Server / MongoDB / Redis 的库表浏览、SQL 查询与数据编辑。",
  "descriptionEn": "Database client: browse schemas, run SQL and edit data across MySQL / PostgreSQL / SQLite / SQL Server / MongoDB / Redis.",
  "icon": "🗄️",
  "iconSvg": "<svg xmlns=\"http://www.w3.org/2000/svg\" viewBox=\"0 0 24 24\" fill=\"none\" stroke=\"currentColor\" stroke-width=\"2\" stroke-linecap=\"round\" stroke-linejoin=\"round\"><ellipse cx=\"12\" cy=\"5\" rx=\"9\" ry=\"3\"/><path d=\"M21 12c0 1.66-4 3-9 3s-9-1.34-9-3\"/><path d=\"M3 5v14c0 1.66 4 3 9 3s9-1.34 9-3V5\"/></svg>",
  "homepage": "https://github.com/xing-shuyin/pi-web-ui/tree/main/plugins/db-client",
  "tags": [
    "plugin"
  ]
}
