{
  "id": "mermaid",
  "name": "mermaid",
  "source": "xing-shuyin/pi-web-ui/plugins/mermaid",
  "author": "xing-shuyin",
  "description": "把对话里的 ```mermaid 围栏渲染成 SVG 图表（fenced-code 渲染插件，本地引擎离线优先）。",
  "descriptionEn": "Renders ```mermaid fences in messages to SVG diagrams (fenced-code renderer plugin, offline-first local engine).",
  "icon": "📊",
  "iconSvg": "<svg xmlns=\"http://www.w3.org/2000/svg\" viewBox=\"0 0 24 24\" fill=\"none\" stroke=\"currentColor\" stroke-width=\"2\" stroke-linecap=\"round\" stroke-linejoin=\"round\"><circle cx=\"18\" cy=\"5\" r=\"3\"/><circle cx=\"6\" cy=\"12\" r=\"3\"/><circle cx=\"18\" cy=\"19\" r=\"3\"/><line x1=\"8.59\" y1=\"13.51\" x2=\"15.42\" y2=\"17.49\"/><line x1=\"15.41\" y1=\"6.51\" x2=\"8.59\" y2=\"10.49\"/></svg>",
  "homepage": "https://github.com/xing-shuyin/pi-web-ui/tree/main/plugins/mermaid",
  "tags": [
    "plugin"
  ]
}
