{
  "id": "webmail",
  "name": "webmail",
  "source": "xing-shuyin/pi-web-ui/plugins/webmail",
  "author": "xing-shuyin",
  "description": "网页邮箱：IMAP 收件 + SMTP 发信 + 新邮件通知，可开放给 AI 直接管理邮件。",
  "descriptionEn": "Web mail: IMAP inbox + SMTP send + new-mail notifications, optionally let the AI manage mail.",
  "icon": "📬",
  "iconSvg": "<svg xmlns=\"http://www.w3.org/2000/svg\" viewBox=\"0 0 24 24\" fill=\"none\" stroke=\"currentColor\" stroke-width=\"2\" stroke-linecap=\"round\" stroke-linejoin=\"round\"><path d=\"M4 4h16c1.1 0 2 .9 2 2v12c0 1.1-.9 2-2 2H4c-1.1 0-2-.9-2-2V6c0-1.1.9-2 2-2z\"/><polyline points=\"22,6 12,13 2,6\"/></svg>",
  "homepage": "https://github.com/xing-shuyin/pi-web-ui/tree/main/plugins/webmail",
  "tags": [
    "plugin"
  ]
}
