{
  "id": "voice-input",
  "name": "语音输入",
  "source": "xing-shuyin/pi-web-ui/plugins/voice-input",
  "author": "xing-shuyin",
  "description": "语音输入：输入框旁的麦克风按钮，浏览器语音识别直接听写进输入框；不支持/识别失败时自动降级为服务端转写（远端接口，或一键安装的本地 Whisper，免费不出网）。",
  "descriptionEn": "Voice input: a mic button next to the composer. Browser speech recognition dictates into the input box, with server-side transcription as automatic fallback (remote API, or one-click local Whisper that runs fully offline).",
  "icon": "🎤",
  "iconSvg": "<svg xmlns=\"http://www.w3.org/2000/svg\" viewBox=\"0 0 24 24\" fill=\"none\" stroke=\"currentColor\" stroke-width=\"2\" stroke-linecap=\"round\" stroke-linejoin=\"round\"><path d=\"M12 1a3 3 0 0 0-3 3v8a3 3 0 0 0 6 0V4a3 3 0 0 0-3-3z\"/><path d=\"M19 10v2a7 7 0 0 1-14 0v-2\"/><line x1=\"12\" y1=\"19\" x2=\"12\" y2=\"23\"/><line x1=\"8\" y1=\"23\" x2=\"16\" y2=\"23\"/></svg>",
  "homepage": "https://github.com/xing-shuyin/pi-web-ui/tree/main/plugins/voice-input",
  "tags": [
    "plugin"
  ]
}
