{
  "id": "live-preview",
  "name": "live-preview",
  "source": "xing-shuyin/pi-web-ui/plugins/live-preview",
  "author": "xing-shuyin",
  "description": "Live Server 式预览：/liveserver 看 HTML（含相对资源与自动刷新），/md 看 Markdown 渲染；真服务只绑回环地址，经宿主通用代理对外只露同源前缀。",
  "descriptionEn": "Live-Server-style preview: HTML under /liveserver (relative assets + auto reload), rendered Markdown under /md. Loopback-only inner server exposed via host proxy prefixes.",
  "icon": "🌐",
  "iconSvg": "<svg xmlns=\"http://www.w3.org/2000/svg\" viewBox=\"0 0 24 24\" fill=\"none\" stroke=\"currentColor\" stroke-width=\"2\" stroke-linecap=\"round\" stroke-linejoin=\"round\"><circle cx=\"12\" cy=\"12\" r=\"10\"/><line x1=\"2\" y1=\"12\" x2=\"22\" y2=\"12\"/><path d=\"M12 2a15.3 15.3 0 0 1 4 10 15.3 15.3 0 0 1-4 10 15.3 15.3 0 0 1-4-10 15.3 15.3 0 0 1 4-10z\"/></svg>",
  "homepage": "https://github.com/xing-shuyin/pi-web-ui/tree/main/plugins/live-preview",
  "tags": [
    "plugin"
  ]
}
