{
  "id": "tunnel",
  "name": "网络隧道",
  "source": "xing-shuyin/pi-web-ui/plugins/tunnel",
  "author": "wu546526",
  "description": "反向隧道：主人设备 CLI 主动连入（零公网暴露，穿 NAT），pi 经本机 SOCKS5 以主人所在网络为出口做巡检与访问（DNS 在主人侧解析）。面板展示隧道在线状态/连接数/令牌管理；注册 tunnel_fetch 工具供 AI 直接探测主人网络。",
  "descriptionEn": "Reverse tunnel: on-prem device CLI connects out; AI reaches that network via local SOCKS5 (DNS resolved device-side).",
  "icon": "🔗",
  "iconSvg": "<svg xmlns=\"http://www.w3.org/2000/svg\" viewBox=\"0 0 24 24\" fill=\"none\" stroke=\"currentColor\" stroke-width=\"2\" stroke-linecap=\"round\" stroke-linejoin=\"round\"><path d=\"M10 13a5 5 0 0 0 7.54.54l3-3a5 5 0 0 0-7.07-7.07l-1.72 1.71\"/><path d=\"M14 11a5 5 0 0 0-7.54-.54l-3 3a5 5 0 0 0 7.07 7.07l1.71-1.71\"/></svg>",
  "homepage": "https://github.com/xing-shuyin/pi-web-ui/tree/main/plugins/tunnel",
  "tags": [
    "plugin",
    "network"
  ]
}
