{
  "id": "approval-gate",
  "name": "拍板",
  "source": "xing-shuyin/pi-web-ui/plugins/approval-gate",
  "author": "wu546526",
  "description": "定时任务拍板中心：待拍板项集中列表，点击跳转对应会话完成拍板；通用 CLI 供任意定时任务登记；顶栏拍板 tab 红点显示待拍板数。",
  "descriptionEn": "Approval gate center: pending decision list, jump to session, tab badge; ships registration CLI.",
  "icon": "🪧",
  "iconSvg": "<svg xmlns=\"http://www.w3.org/2000/svg\" viewBox=\"0 0 24 24\" fill=\"none\" stroke=\"currentColor\" stroke-width=\"2\" stroke-linecap=\"round\" stroke-linejoin=\"round\"><path d=\"M22 5H2v11h20z\"/><path d=\"M12 16v4\"/><path d=\"M8 20h8\"/><path d=\"M7 9l3 3 5-5\"/></svg>",
  "homepage": "https://github.com/xing-shuyin/pi-web-ui/tree/main/plugins/approval-gate",
  "tags": [
    "plugin",
    "workflow"
  ]
}
