{
  "id": "wechat-ilink",
  "name": "微信通道",
  "source": "xing-shuyin/pi-web-ui/plugins/wechat-ilink",
  "author": "xing-shuyin",
  "description": "微信扫码登录（与腾讯 openclaw-weixin 同源的 ilink 协议）：出站长轮询收消息，微信里直接指挥 agent，无需公网 IP。",
  "descriptionEn": "WeChat channel (ilink protocol, same origin as Tencent openclaw-weixin): outbound long-polling, drive the agent from WeChat, no public IP needed.",
  "icon": "💬",
  "iconSvg": "<svg xmlns=\"http://www.w3.org/2000/svg\" viewBox=\"0 0 24 24\" fill=\"none\" stroke=\"currentColor\" stroke-width=\"2\" stroke-linecap=\"round\" stroke-linejoin=\"round\"><path d=\"M21 11.5a8.38 8.38 0 0 1-.9 3.8 8.5 8.5 0 0 1-7.6 4.7 8.38 8.38 0 0 1-3.8-.9L3 21l1.9-5.7a8.38 8.38 0 0 1-.9-3.8 8.5 8.5 0 0 1 4.7-7.6 8.38 8.38 0 0 1 3.8-.9h.5a8.48 8.48 0 0 1 8 8v.5z\"/></svg>",
  "homepage": "https://github.com/xing-shuyin/pi-web-ui/tree/main/plugins/wechat-ilink",
  "tags": [
    "plugin"
  ]
}
