{
  "id": "notes",
  "name": "笔记",
  "source": "xing-shuyin/pi-web-ui/plugins/notes",
  "author": "xing-shuyin",
  "description": "随手记：笔记 + 待办 + 日程提醒三合一。顶栏按钮打开可自由拖拽的全局浮窗（位置/尺寸记忆，设置也在浮窗里，无独立视图页）；提醒走服务端定时（重启不丢、错过补送），另有 5 个 AI 工具与 /note /todo /remind 快速捕获。",
  "descriptionEn": "Notes, todos and scheduled reminders in one place: a freely draggable always-on-top panel (position, size and settings all live in it, no separate view tab); reminders fire server-side (survive restarts, delivered on next open), with 5 AI tools and /note /todo /remind quick capture.",
  "icon": "📓",
  "iconSvg": "<svg xmlns=\"http://www.w3.org/2000/svg\" viewBox=\"0 0 1024 1024\"><path d=\"M746.666667 64a170.666667 170.666667 0 0 1 170.666666 170.666667v554.666666a170.666667 170.666667 0 0 1-170.666666 170.666667H298.666667a170.666667 170.666667 0 0 1-170.666667-170.666667V234.666667a170.666667 170.666667 0 0 1 170.666667-170.666667h448z m0 74.666667H298.666667a96 96 0 0 0-95.893334 91.477333L202.666667 234.666667v554.666666a96 96 0 0 0 91.477333 95.893334L298.666667 885.333333h448a96 96 0 0 0 95.893333-91.477333L842.666667 789.333333V234.666667a96 96 0 0 0-91.477334-95.893334L746.666667 138.666667z\" fill=\"currentColor\"/><path d=\"M224 325.333333a37.333333 37.333333 0 0 1 3.072 74.538667l-3.072 0.128H106.666667a37.333333 37.333333 0 0 1-3.072-74.538667L106.666667 325.333333h117.333333zM224 624a37.333333 37.333333 0 0 1 3.072 74.538667l-3.072 0.128H106.666667a37.333333 37.333333 0 0 1-3.072-74.538667L106.666667 624h117.333333zM693.333333 346.666667a37.333333 37.333333 0 0 1 37.205334 34.261333l0.128 3.072v256a37.333333 37.333333 0 0 1-74.538667 3.072L656 640V384c0-20.608 16.725333-37.333333 37.333333-37.333333z\" fill=\"currentColor\"/></svg>",
  "homepage": "https://github.com/xing-shuyin/pi-web-ui/tree/main/plugins/notes",
  "tags": [
    "plugin"
  ]
}
